{
  "version": "1.0.0",
  "stand": "2025-06-30",
  "vokabular": {
    "projekte": ["oneSCM Portal", "Lieferanten-Cockpit", "Bestell-Checkout", "Admin-Konsole"],
    "kategorien": ["Barrierefreiheit", "Navigation", "Formular", "Layout", "Typografie", "Farbe & Kontrast", "Datenvisualisierung", "Fehlerzustände"],
    "status": ["übernommen", "in Prüfung", "verworfen"],
    "viewports": [
      { "id": "desktop", "label": "Desktop 1440 × 900", "breite": 1440, "hoehe": 900 },
      { "id": "tablet", "label": "Tablet 1024 × 768", "breite": 1024, "hoehe": 768 },
      { "id": "mobil", "label": "Mobil 390 × 844", "breite": 390, "hoehe": 844 }
    ]
  },
  "eintraege": [
    {
      "id": "SCR-2025-001",
      "titel": "Kontrast der Sekundärnavigation angehoben",
      "projekt": "oneSCM Portal",
      "seite": "/portal/uebersicht",
      "kategorie": "Barrierefreiheit",
      "status": "übernommen",
      "viewport": "desktop",
      "browser": "Chrome 141",
      "autor": "M. Ackermann",
      "datum": "2025-03-04",
      "tags": ["kontrast", "navigation", "wcag-aa"],
      "begruendung": {
        "anlass": "Im Barrierefreiheits-Audit fiel die Sekundärnavigation mit einem Kontrastverhältnis von 2,8:1 durch; WCAG 2.2 AA verlangt mindestens 4,5:1 für Fließtext.",
        "aenderung": "Textfarbe von Hellgrau auf ein dunkles Blaugrau gesetzt, aktiver Eintrag zusätzlich durch eine Markierungsleiste am linken Rand gekennzeichnet.",
        "wirkung": "Kontrastverhältnis auf 5,1:1 angehoben, die Suche nach dem aktiven Bereich dauert im Test spürbar kürzer.",
        "quelle": "Audit Barrierefreiheit Q1/2025, Befund A-14"
      },
      "metriken": [
        { "name": "Kontrastverhältnis", "einheit": ":1", "vorher": 2.8, "nachher": 5.1, "richtung": "groesser_besser" },
        { "name": "Aufgabendauer", "einheit": "s", "vorher": 42, "nachher": 33, "richtung": "kleiner_besser" }
      ],
      "archiviert": false,
      "archiviert_am": null,
      "archiv_grund": null,
      "screen": {
        "archetyp": "uebersicht",
        "vorher": { "aufgenommen": "2025-02-18", "kontrast": "niedrig", "dichte": "normal", "hierarchie": false },
        "nachher": { "aufgenommen": "2025-03-04", "kontrast": "hoch", "dichte": "normal", "hierarchie": false }
      }
    },
    {
      "id": "SCR-2025-002",
      "titel": "Bestellübersicht als Tabelle statt Kachelraster",
      "projekt": "oneSCM Portal",
      "seite": "/portal/bestellungen",
      "kategorie": "Layout",
      "status": "übernommen",
      "viewport": "desktop",
      "browser": "Chrome 140",
      "autor": "S. Brandt",
      "datum": "2025-03-19",
      "tags": ["tabelle", "vergleichbarkeit", "scrolltiefe"],
      "begruendung": {
        "anlass": "Einkäuferinnen vergleichen Bestellungen spaltenweise. Das Kachelraster zwang zum Springen zwischen Karten und erzeugte lange Scrollwege.",
        "aenderung": "Kachelraster durch eine Tabelle mit festen Spalten für Nummer, Lieferant, Termin, Betrag und Status ersetzt, Kopfzeile sortierbar.",
        "wirkung": "Der Weg bis zur gesuchten Bestellung halbierte sich, die nötige Scrolltiefe sank deutlich.",
        "quelle": "Beobachtungsstudie Einkauf, 6 Teilnehmende, 2025-03-11"
      },
      "metriken": [
        { "name": "Klicks bis Ziel", "einheit": "Klicks", "vorher": 6, "nachher": 3, "richtung": "kleiner_besser" },
        { "name": "Scrolltiefe bis Aktion", "einheit": "%", "vorher": 78, "nachher": 31, "richtung": "kleiner_besser" }
      ],
      "archiviert": false,
      "archiviert_am": null,
      "archiv_grund": null,
      "screen": {
        "archetyp": "liste",
        "vorher": { "aufgenommen": "2025-03-05", "spalten": 3, "dichte": "luftig", "kontrast": "mittel" },
        "nachher": { "aufgenommen": "2025-03-19", "spalten": 1, "dichte": "normal", "kontrast": "hoch" }
      }
    },
    {
      "id": "SCR-2025-003",
      "titel": "Primäraktion im Checkout hervorgehoben",
      "projekt": "Bestell-Checkout",
      "seite": "/checkout/zahlung",
      "kategorie": "Farbe & Kontrast",
      "status": "übernommen",
      "viewport": "desktop",
      "browser": "Chrome 141",
      "autor": "J. Kern",
      "datum": "2025-04-02",
      "tags": ["primaeraktion", "abbruchquote", "checkout"],
      "begruendung": {
        "anlass": "Alle drei Schaltflächen des Zahlungsschritts sahen gleich aus; im Test klickten vier von neun Personen zuerst auf 'Zurück'.",
        "aenderung": "Nur 'Zahlungspflichtig bestellen' bleibt gefüllt und farbig, die Nebenaktionen erhalten eine reine Konturform ohne Füllung.",
        "wirkung": "Die Abbruchquote im Zahlungsschritt sank um ein Drittel, die Dauer bis zum Abschluss verkürzte sich.",
        "quelle": "A/B-Test CHK-19, Laufzeit 2025-03-17 bis 2025-03-31"
      },
      "metriken": [
        { "name": "Abbruchquote", "einheit": "%", "vorher": 24.5, "nachher": 16.2, "richtung": "kleiner_besser" },
        { "name": "Aufgabendauer", "einheit": "s", "vorher": 71, "nachher": 58, "richtung": "kleiner_besser" }
      ],
      "archiviert": false,
      "archiviert_am": null,
      "archiv_grund": null,
      "screen": {
        "archetyp": "checkout",
        "vorher": { "aufgenommen": "2025-03-16", "primaer": false, "kontrast": "mittel" },
        "nachher": { "aufgenommen": "2025-04-02", "primaer": true, "kontrast": "hoch" }
      }
    },
    {
      "id": "SCR-2025-004",
      "titel": "Formularfehler direkt am Feld statt in Sammelmeldung",
      "projekt": "Lieferanten-Cockpit",
      "seite": "/cockpit/stammdaten",
      "kategorie": "Formular",
      "status": "übernommen",
      "viewport": "desktop",
      "browser": "Firefox 143",
      "autor": "S. Brandt",
      "datum": "2025-04-15",
      "tags": ["validierung", "fehlermeldung", "stammdaten"],
      "begruendung": {
        "anlass": "Die Sammelmeldung am Seitenkopf nannte die Feldnamen, nicht ihre Position. Lieferanten scrollten mehrfach zwischen Meldung und Feld hin und her.",
        "aenderung": "Meldung an das jeweilige Feld gesetzt, Feldrahmen markiert und der Text sagt, was einzutragen ist statt nur, dass etwas fehlt.",
        "wirkung": "Die Fehlerquote beim Absenden sank auf ein Drittel, das Ausfüllen dauert rund eine halbe Minute weniger.",
        "quelle": "Auswertung Formular-Telemetrie KW 12–16/2025"
      },
      "metriken": [
        { "name": "Fehlerquote im Formular", "einheit": "%", "vorher": 31, "nachher": 12, "richtung": "kleiner_besser" },
        { "name": "Aufgabendauer", "einheit": "s", "vorher": 96, "nachher": 64, "richtung": "kleiner_besser" }
      ],
      "archiviert": false,
      "archiviert_am": null,
      "archiv_grund": null,
      "screen": {
        "archetyp": "formular",
        "vorher": { "aufgenommen": "2025-03-28", "fehlerAmFeld": false, "hinweis": "3 Fehler im Formular", "kontrast": "mittel" },
        "nachher": { "aufgenommen": "2025-04-15", "fehlerAmFeld": true, "hinweis": null, "kontrast": "hoch" }
      }
    },
    {
      "id": "SCR-2025-005",
      "titel": "Filterleiste auf Mobil einklappbar",
      "projekt": "oneSCM Portal",
      "seite": "/portal/bestellungen",
      "kategorie": "Navigation",
      "status": "übernommen",
      "viewport": "mobil",
      "browser": "Safari 18.4",
      "autor": "M. Ackermann",
      "datum": "2025-04-28",
      "tags": ["mobil", "filter", "scrolltiefe"],
      "begruendung": {
        "anlass": "Auf dem Telefon füllte die dauerhaft ausgeklappte Filterleiste den halben Bildschirm; die erste Bestellung war erst nach vier Wischgesten sichtbar.",
        "aenderung": "Filter hinter eine Schaltfläche mit Trefferzähler gelegt, gesetzte Filter bleiben als kompakte Chips sichtbar.",
        "wirkung": "Die erste Zeile ist ohne Wischen erreichbar, deutlich mehr Personen schließen die Suche erfolgreich ab.",
        "quelle": "Feldtest Mobil, 11 Teilnehmende, April 2025"
      },
      "metriken": [
        { "name": "Scrolltiefe bis Aktion", "einheit": "%", "vorher": 84, "nachher": 38, "richtung": "kleiner_besser" },
        { "name": "Erfolgsquote", "einheit": "%", "vorher": 62, "nachher": 81, "richtung": "groesser_besser" }
      ],
      "archiviert": false,
      "archiviert_am": null,
      "archiv_grund": null,
      "screen": {
        "archetyp": "liste",
        "vorher": { "aufgenommen": "2025-04-09", "dichte": "eng", "spalten": 1, "kontrast": "mittel" },
        "nachher": { "aufgenommen": "2025-04-28", "dichte": "normal", "spalten": 1, "kontrast": "hoch", "suchfeld": true }
      }
    },
    {
      "id": "SCR-2025-006",
      "titel": "Statusfarben durch Symbole ergänzt",
      "projekt": "oneSCM Portal",
      "seite": "/portal/bestellungen",
      "kategorie": "Barrierefreiheit",
      "status": "übernommen",
      "viewport": "desktop",
      "browser": "Chrome 141",
      "autor": "T. Weiß",
      "datum": "2025-05-06",
      "tags": ["farbfehlsichtigkeit", "status", "symbole"],
      "begruendung": {
        "anlass": "Der Status wurde allein über Farbe codiert. Bei Rotgrünschwäche waren 'freigegeben' und 'abgelehnt' im Test nicht unterscheidbar.",
        "aenderung": "Jede Statusmarke erhält ein eigenes Symbol und den ausgeschriebenen Text; die Farbe bleibt als zusätzliche Ebene erhalten.",
        "wirkung": "Der Status wurde in der Simulation von nahezu allen Teilnehmenden korrekt benannt.",
        "quelle": "Test mit Farbfehlsichtigkeits-Simulation, 2025-04-30"
      },
      "metriken": [
        { "name": "Erfolgsquote", "einheit": "%", "vorher": 68, "nachher": 94, "richtung": "groesser_besser" }
      ],
      "archiviert": false,
      "archiviert_am": null,
      "archiv_grund": null,
      "screen": {
        "archetyp": "liste",
        "vorher": { "aufgenommen": "2025-04-22", "symbole": false, "spalten": 1, "kontrast": "mittel" },
        "nachher": { "aufgenommen": "2025-05-06", "symbole": true, "spalten": 1, "kontrast": "hoch" }
      }
    },
    {
      "id": "SCR-2025-007",